{
  "$schema": "https://shadcn-svelte.com/schema/registry-item.json",
  "name": "tags-input",
  "type": "registry:ui",
  "title": "Tags Input",
  "description": "A field that collects entries as soft pill chips.",
  "dependencies": [
    "@lucide/svelte@^1.34.0"
  ],
  "registryDependencies": [
    "https://mizu-ui.com/r/v0.2.1/utils.json"
  ],
  "files": [
    {
      "type": "registry:file",
      "target": "tags-input/index.ts",
      "content": "export { default as TagsInput } from './tags-input.svelte';\n"
    },
    {
      "type": "registry:file",
      "target": "tags-input/tags-input.svelte",
      "content": "<script lang=\"ts\">\n\timport type { HTMLAttributes } from 'svelte/elements';\n\timport XIcon from '@lucide/svelte/icons/x';\n\timport { cn } from '$lib/utils.js';\n\n\ttype Props = Omit<HTMLAttributes<HTMLDivElement>, 'onchange'> & {\n\t\tvalue?: string[];\n\t\tplaceholder?: string;\n\t\tdisabled?: boolean;\n\t\t/** Maximum tags, rounded and clamped to the inclusive range 0 to 1000. */\n\t\tmax?: number;\n\t\tname?: string;\n\t\tdedupe?: boolean;\n\t\tvalidate?: (tag: string) => boolean;\n\t\tclass?: string;\n\t\tonValueChange?: (value: string[]) => void;\n\t};\n\n\tlet {\n\t\tvalue = $bindable([]),\n\t\tplaceholder,\n\t\tdisabled = false,\n\t\tmax,\n\t\tname,\n\t\tdedupe = true,\n\t\tvalidate,\n\t\tclass: className,\n\t\tonValueChange,\n\t\t...rest\n\t}: Props = $props();\n\n\tlet draft = $state('');\n\tlet inputEl = $state<HTMLInputElement | null>(null);\n\n\tconst normalizedMax = $derived(\n\t\tmax == null\n\t\t\t? undefined\n\t\t\t: Math.min(1000, Math.max(0, Math.round(Number.isFinite(max) ? max : 1000)))\n\t);\n\tconst atMax = $derived(normalizedMax != null && value.length >= normalizedMax);\n\n\tfunction setValue(next: string[]) {\n\t\tvalue = next;\n\t\tonValueChange?.(next);\n\t}\n\n\tfunction addTag(raw: string) {\n\t\tconst tag = raw.trim();\n\t\tif (!tag || disabled || atMax) return;\n\t\tif (dedupe && value.includes(tag)) return;\n\t\tif (validate && !validate(tag)) return;\n\t\tsetValue([...value, tag]);\n\t}\n\n\tfunction removeAt(index: number) {\n\t\tif (disabled) return;\n\t\tsetValue(value.filter((_, i) => i !== index));\n\t}\n\n\tfunction commitDraft() {\n\t\tif (!draft.trim()) return;\n\t\taddTag(draft);\n\t\tdraft = '';\n\t}\n\n\tfunction onkeydown(e: KeyboardEvent) {\n\t\tif (e.key === 'Enter' || e.key === ',') {\n\t\t\te.preventDefault();\n\t\t\tcommitDraft();\n\t\t} else if (e.key === 'Backspace' && draft === '' && value.length > 0) {\n\t\t\te.preventDefault();\n\t\t\tremoveAt(value.length - 1);\n\t\t}\n\t}\n</script>\n\n<div\n\tclass={cn(\n\t\t'bg-secondary focus-within:ring-ring/35 flex min-h-10 w-full flex-wrap items-center gap-1.5 rounded-2xl px-2.5 py-2 text-sm transition-[box-shadow,border-color] duration-150 outline-none focus-within:ring-2',\n\t\tdisabled && 'cursor-not-allowed opacity-50',\n\t\tclassName\n\t)}\n\tonmousedown={(e) => {\n\t\tif (e.target === e.currentTarget) inputEl?.focus();\n\t}}\n\t{...rest}\n>\n\t<ul class=\"contents\">\n\t\t{#each value as tag, i (tag + i)}\n\t\t\t<li\n\t\t\t\tclass=\"bg-primary text-primary-foreground inline-flex h-6 items-center gap-1 rounded-full pr-1 pl-2.5 text-xs font-medium shadow-xs\"\n\t\t\t>\n\t\t\t\t<span>{tag}</span>\n\t\t\t\t<button\n\t\t\t\t\ttype=\"button\"\n\t\t\t\t\t{disabled}\n\t\t\t\t\tonclick={() => removeAt(i)}\n\t\t\t\t\tclass=\"text-primary-foreground/80 hover:text-primary-foreground inline-grid size-4 place-items-center rounded-full transition-[background-color,color] duration-150 outline-none hover:bg-white/25 focus-visible:ring-2 focus-visible:ring-white/70 disabled:pointer-events-none\"\n\t\t\t\t>\n\t\t\t\t\t<XIcon class=\"size-3\" />\n\t\t\t\t\t<span class=\"sr-only\">Remove {tag}</span>\n\t\t\t\t</button>\n\t\t\t</li>\n\t\t{/each}\n\t</ul>\n\n\t<input\n\t\tbind:this={inputEl}\n\t\tbind:value={draft}\n\t\ttype=\"text\"\n\t\t{disabled}\n\t\tplaceholder={atMax ? undefined : placeholder}\n\t\taria-label=\"Add a tag\"\n\t\treadonly={atMax}\n\t\t{onkeydown}\n\t\tonblur={commitDraft}\n\t\tclass=\"text-foreground placeholder:text-muted-foreground flex-1 basis-24 bg-transparent outline-none disabled:cursor-not-allowed\"\n\t/>\n\n\t{#if name}\n\t\t{#each value as tag, i (tag + i)}\n\t\t\t<input type=\"hidden\" {name} value={tag} />\n\t\t{/each}\n\t{/if}\n</div>\n"
    }
  ]
}
