{
  "$schema": "https://shadcn-svelte.com/schema/registry-item.json",
  "name": "label",
  "type": "registry:ui",
  "title": "Label",
  "description": "An accessible, selectable form label.",
  "dependencies": [],
  "registryDependencies": [
    "https://mizu-ui.com/r/latest/utils.json"
  ],
  "files": [
    {
      "type": "registry:file",
      "target": "label/index.ts",
      "content": "export { default as Label } from './label.svelte';\n"
    },
    {
      "type": "registry:file",
      "target": "label/label.svelte",
      "content": "<script lang=\"ts\">\n\timport type { Snippet } from 'svelte';\n\timport type { HTMLLabelAttributes } from 'svelte/elements';\n\timport { cn } from '$lib/utils.js';\n\n\ttype Props = HTMLLabelAttributes & { class?: string; children?: Snippet };\n\tlet { class: className, children, ...rest }: Props = $props();\n</script>\n\n<label\n\tclass={cn(\n\t\t'text-foreground flex items-center gap-2 text-sm font-semibold select-none peer-disabled:opacity-50 has-[+:disabled]:opacity-50',\n\t\tclassName\n\t)}\n\t{...rest}\n>\n\t{@render children?.()}\n</label>\n"
    }
  ]
}
