{
  "$schema": "https://shadcn-svelte.com/schema/registry-item.json",
  "name": "banner",
  "type": "registry:ui",
  "title": "Banner",
  "description": "An announcement bar that folds away on dismiss while the page slides up to fill the gap.",
  "dependencies": [
    "@lucide/svelte@^1.48.0"
  ],
  "registryDependencies": [
    "https://mizu-ui.com/r/motion.json",
    "https://mizu-ui.com/r/utils.json"
  ],
  "files": [
    {
      "type": "registry:file",
      "target": "banner/banner.svelte",
      "content": "<script lang=\"ts\">\n\timport { tick, untrack, type Snippet } from 'svelte';\n\timport type { HTMLAttributes } from 'svelte/elements';\n\timport X from '@lucide/svelte/icons/x';\n\timport { prefersReducedMotion } from '$lib/components/ui/motion';\n\timport { cn } from '$lib/utils.js';\n\n\ttype Props = Omit<HTMLAttributes<HTMLElement>, 'children'> & {\n\t\t/**\n\t\t * Whether the bar shows. Bindable. Closing folds the bar away and the\n\t\t * page below slides up into its space; opening reverses it.\n\t\t */\n\t\topen?: boolean;\n\t\t/** Called after the dismiss button closes the bar. */\n\t\tonDismiss?: () => void;\n\t\t/**\n\t\t * Where keyboard focus goes when the dismiss button closes the bar, as an\n\t\t * element or a CSS selector. By default it moves to the first focusable\n\t\t * element after the bar, then the nearest one before it, and only lands on\n\t\t * the page itself when there is nothing else. Focus that `onDismiss`\n\t\t * already moved elsewhere is left alone.\n\t\t */\n\t\treturnFocus?: HTMLElement | string;\n\t\t/** Shows the dismiss button. */\n\t\tdismissible?: boolean;\n\t\t/** Accessible name for the bar's region. */\n\t\tlabel?: string;\n\t\t/** Accessible name for the dismiss button. */\n\t\tdismissLabel?: string;\n\t\t/** `primary` is the bold, inverted bar; `secondary` is a quiet gray one. */\n\t\tvariant?: 'primary' | 'secondary';\n\t\t/** A small leading glyph, decorative. */\n\t\ticon?: Snippet;\n\t\t/** Trailing content after the message, such as a link. */\n\t\taction?: Snippet;\n\t\t/** The message. */\n\t\tchildren: Snippet;\n\t\t/** The bar's section element. */\n\t\tref?: HTMLElement | null;\n\t\t/** Classes for the bar. */\n\t\tclass?: string;\n\t};\n\n\tlet {\n\t\topen = $bindable(true),\n\t\tonDismiss,\n\t\treturnFocus,\n\t\tdismissible = true,\n\t\tlabel = 'Announcement',\n\t\tdismissLabel = 'Dismiss announcement',\n\t\tvariant = 'primary',\n\t\ticon,\n\t\taction,\n\t\tchildren,\n\t\tref = $bindable(null),\n\t\tclass: className,\n\t\t...restProps\n\t}: Props = $props();\n\n\t// The very first appearance slides down from above. Every later one reverses\n\t// the dismissal instead: the space opens, then the bar fades in.\n\tlet wasOpen = untrack(() => open);\n\tlet dismissedOnce = $state(false);\n\t$effect.pre(() => {\n\t\tif (wasOpen && !open) dismissedOnce = true;\n\t\twasOpen = open;\n\t});\n\n\tconst FOCUSABLE =\n\t\t'a[href], button:not([disabled]), input:not([disabled]):not([type=\"hidden\"]), select:not([disabled]), textarea:not([disabled]), summary, iframe, audio[controls], video[controls], [contenteditable]:not([contenteditable=\"false\"]), [tabindex]:not([tabindex=\"-1\"])';\n\n\t/** Out of reach: inside something inert or hidden. */\n\tfunction unreachable(el: Element) {\n\t\tfor (let node: Element | null = el; node; node = node.parentElement) {\n\t\t\tconst inert = node.getAttribute('inert');\n\t\t\tif (inert !== null && inert !== 'false') return true;\n\t\t\tif (node.hasAttribute('hidden') || node.getAttribute('aria-hidden') === 'true') return true;\n\t\t}\n\t\treturn el instanceof HTMLElement && el.checkVisibility?.() === false;\n\t}\n\n\tfunction focusable(el: Element | null | undefined): el is HTMLElement {\n\t\treturn el instanceof HTMLElement && el.matches(FOCUSABLE) && !unreachable(el);\n\t}\n\n\t/** The nearest focusable element outside `root`, after it first, then before it. */\n\tfunction neighbour(root: Element) {\n\t\tconst walker = document.createTreeWalker(document.body, NodeFilter.SHOW_ELEMENT);\n\t\tfor (const step of ['nextNode', 'previousNode'] as const) {\n\t\t\twalker.currentNode = root;\n\t\t\tfor (let node = walker[step](); node; node = walker[step]()) {\n\t\t\t\t// Skips the bar's own contents and, going back, the elements holding it.\n\t\t\t\tif (root.contains(node) || node.contains(root)) continue;\n\t\t\t\tif (focusable(node as Element)) return node as HTMLElement;\n\t\t\t}\n\t\t}\n\t\treturn null;\n\t}\n\n\tlet wrapper = $state<HTMLDivElement | null>(null);\n\n\tasync function handOffFocus() {\n\t\tawait tick();\n\t\tconst active = document.activeElement;\n\t\t// `onDismiss` may have placed focus somewhere on purpose.\n\t\tif (active && active !== document.body && !ref?.contains(active)) return;\n\t\tconst chosen =\n\t\t\ttypeof returnFocus === 'string' ? document.querySelector(returnFocus) : returnFocus;\n\t\tconst target = focusable(chosen) ? chosen : wrapper && neighbour(wrapper);\n\t\tif (target) target.focus({ preventScroll: true });\n\t\telse if (active instanceof HTMLElement && active !== document.body) active.blur();\n\t}\n\n\tfunction dismiss() {\n\t\t// The bar turns inert as it closes, which would drop focus on the page.\n\t\tconst hadFocus = !!ref?.contains(document.activeElement);\n\t\topen = false;\n\t\tonDismiss?.();\n\t\tif (hadFocus) void handOffFocus();\n\t}\n\n\t// The height moves on the house curve: quick to start and long to settle, so\n\t// the page below glides instead of lurching. Closing waits a beat for the\n\t// text to fade, so it never gets squeezed while it is still readable.\n\t// Reduced motion snaps both ways; the global rule would shorten the\n\t// durations but keep the delays, leaving a pause before the snap.\n\tconst rows = $derived(\n\t\tprefersReducedMotion()\n\t\t\t? 'none'\n\t\t\t: open\n\t\t\t\t? 'grid-template-rows var(--duration-slow) var(--ease-out)'\n\t\t\t\t: 'grid-template-rows var(--duration-base) var(--ease-out) var(--duration-instant)'\n\t);\n\tconst content = $derived(\n\t\tprefersReducedMotion()\n\t\t\t? 'none'\n\t\t\t: !open\n\t\t\t\t? 'opacity var(--duration-instant) var(--ease-in), filter var(--duration-instant) var(--ease-in)'\n\t\t\t\t: dismissedOnce\n\t\t\t\t\t? // Starts once the space has mostly opened.\n\t\t\t\t\t\t'opacity var(--duration-base) var(--ease-out) var(--duration-fast), filter var(--duration-base) var(--ease-out) var(--duration-fast)'\n\t\t\t\t\t: 'translate var(--duration-slow) var(--ease-out), opacity var(--duration-base) var(--ease-out), filter var(--duration-base) var(--ease-out)'\n\t);\n\tconst tucked = $derived(!open && !dismissedOnce);\n</script>\n\n<div\n\tbind:this={wrapper}\n\tclass=\"grid\"\n\tdata-state={open ? 'open' : 'closed'}\n\tstyle:grid-template-rows={open ? '1fr' : '0fr'}\n\tstyle:transition={rows}\n>\n\t<div class=\"min-h-0 overflow-hidden\">\n\t\t<section\n\t\t\tbind:this={ref}\n\t\t\taria-label={label}\n\t\t\tinert={!open}\n\t\t\ttabindex=\"-1\"\n\t\t\tclass={cn(\n\t\t\t\t'flex min-h-11 items-center gap-2.5 py-1.5 pr-1.5 pl-4 text-sm outline-none',\n\t\t\t\tvariant === 'primary'\n\t\t\t\t\t? 'bg-primary text-primary-foreground'\n\t\t\t\t\t: 'bg-secondary text-secondary-foreground',\n\t\t\t\tclassName\n\t\t\t)}\n\t\t\tstyle:opacity={open ? 1 : 0}\n\t\t\tstyle:filter={open ? 'blur(0px)' : 'blur(2px)'}\n\t\t\tstyle:translate={tucked ? '0 -100%' : '0 0'}\n\t\t\tstyle:transition={content}\n\t\t\t{...restProps}\n\t\t>\n\t\t\t{#if icon}\n\t\t\t\t<span aria-hidden=\"true\" class=\"flex shrink-0 [&_svg]:size-4\">{@render icon()}</span>\n\t\t\t{/if}\n\t\t\t<p class=\"min-w-0 flex-1 text-pretty\">{@render children()}</p>\n\t\t\t{#if action}\n\t\t\t\t<span\n\t\t\t\t\tclass={cn(\n\t\t\t\t\t\t'shrink-0 [&_a]:rounded-sm [&_a]:font-medium [&_a]:underline [&_a]:underline-offset-[3px] [&_a]:transition-[text-decoration-color] [&_a]:duration-(--duration-fast) [&_a]:outline-none [&_a]:focus-visible:outline-2 [&_a]:focus-visible:outline-offset-2 [&_a]:focus-visible:outline-current',\n\t\t\t\t\t\tvariant === 'primary'\n\t\t\t\t\t\t\t? '[&_a]:decoration-primary-foreground/40 [&_a:hover]:decoration-primary-foreground'\n\t\t\t\t\t\t\t: '[&_a]:decoration-foreground/30 [&_a:hover]:decoration-foreground'\n\t\t\t\t\t)}\n\t\t\t\t>\n\t\t\t\t\t{@render action()}\n\t\t\t\t</span>\n\t\t\t{/if}\n\t\t\t{#if dismissible}\n\t\t\t\t<button\n\t\t\t\t\ttype=\"button\"\n\t\t\t\t\taria-label={dismissLabel}\n\t\t\t\t\tonclick={dismiss}\n\t\t\t\t\tclass={cn(\n\t\t\t\t\t\t'relative ml-auto inline-flex size-8 shrink-0 touch-manipulation items-center justify-center rounded-full outline-none select-none',\n\t\t\t\t\t\t'transition-[scale,color,background-color] duration-(--duration-fast) ease-out active:scale-[0.96]',\n\t\t\t\t\t\t'focus-visible:outline-2 focus-visible:outline-current',\n\t\t\t\t\t\t// Grows the hit area to 40px without growing the circle.\n\t\t\t\t\t\t'after:absolute after:-inset-1 after:rounded-full',\n\t\t\t\t\t\tvariant === 'primary'\n\t\t\t\t\t\t\t? 'text-primary-foreground/70 hover:bg-primary-foreground/15 hover:text-primary-foreground'\n\t\t\t\t\t\t\t: 'text-muted-foreground hover:bg-foreground/8 hover:text-foreground'\n\t\t\t\t\t)}\n\t\t\t\t>\n\t\t\t\t\t<X class=\"size-4\" aria-hidden=\"true\" />\n\t\t\t\t</button>\n\t\t\t{/if}\n\t\t</section>\n\t</div>\n</div>\n"
    },
    {
      "type": "registry:file",
      "target": "banner/index.ts",
      "content": "export { default as Banner } from './banner.svelte';\n"
    }
  ]
}
