{
  "$schema": "https://shadcn-svelte.com/schema/registry-item.json",
  "name": "progress",
  "type": "registry:ui",
  "title": "Progress",
  "description": "A neutral track with a contrasting progress indicator.",
  "dependencies": [
    "bits-ui@^2.19.3"
  ],
  "registryDependencies": [
    "https://mizu-ui.com/r/v0.5.0/utils.json"
  ],
  "files": [
    {
      "type": "registry:file",
      "target": "progress/index.ts",
      "content": "export { default as Progress } from './progress.svelte';\n"
    },
    {
      "type": "registry:file",
      "target": "progress/progress.svelte",
      "content": "<script lang=\"ts\">\n\timport { Progress as ProgressPrimitive, type WithoutChildrenOrChild } from 'bits-ui';\n\timport { cn } from '$lib/utils.js';\n\n\tlet {\n\t\tref = $bindable(null),\n\t\tvalue = $bindable(0),\n\t\tmax = 100,\n\t\tclass: className,\n\t\t...restProps\n\t}: WithoutChildrenOrChild<ProgressPrimitive.RootProps> & { class?: string } = $props();\n\n\tconst pct = $derived(max ? (100 * (value ?? 0)) / max : 0);\n</script>\n\n<ProgressPrimitive.Root\n\tbind:ref\n\t{value}\n\t{max}\n\tclass={cn('bg-muted relative h-3 w-full overflow-hidden rounded-full ', className)}\n\t{...restProps}\n>\n\t<div\n\t\tclass=\"bg-primary relative h-full overflow-hidden rounded-full transition-[width] duration-(--duration-slow) ease-out\"\n\t\tstyle=\"width: {pct}%\"\n\t></div>\n</ProgressPrimitive.Root>\n"
    }
  ]
}
