{
  "$schema": "https://shadcn-svelte.com/schema/registry-item.json",
  "name": "sticky-stack",
  "type": "registry:ui",
  "title": "Sticky Stack",
  "description": "Cards pile up and sink back as you scroll.",
  "dependencies": [],
  "registryDependencies": [
    "https://mizu-ui.com/r/motion.json",
    "https://mizu-ui.com/r/utils.json"
  ],
  "files": [
    {
      "type": "registry:file",
      "target": "sticky-stack/index.ts",
      "content": "export { default as StickyStack, type StickyStackItem } from './sticky-stack.svelte';\n"
    },
    {
      "type": "registry:file",
      "target": "sticky-stack/sticky-stack.svelte",
      "content": "<script lang=\"ts\" module>\n\texport type StickyStackItem = {\n\t\t/** The card's heading. Also names its jump button. */\n\t\ttitle: string;\n\t\t/** A line or two under the heading. */\n\t\tdescription: string;\n\t};\n</script>\n\n<script lang=\"ts\">\n\timport type { Snippet } from 'svelte';\n\timport type { HTMLAttributes } from 'svelte/elements';\n\timport { prefersReducedMotion } from '$lib/components/ui/motion';\n\timport { cn } from '$lib/utils.js';\n\n\ttype Props = Omit<HTMLAttributes<HTMLDivElement>, 'children'> & {\n\t\t/** The cards, in the order they pile up. */\n\t\titems: StickyStackItem[];\n\t\t/** Names the scroll region for assistive technology. */\n\t\tlabel: string;\n\t\t/** Content above the first card, such as a title and a hint to scroll. */\n\t\theading?: Snippet;\n\t\t/** Label for the column of jump buttons beside the stack. */\n\t\tnavLabel?: string;\n\t\t/** The root element. */\n\t\tref?: HTMLDivElement | null;\n\t\t/** Classes for the root element. */\n\t\tclass?: string;\n\t};\n\n\tlet {\n\t\titems,\n\t\tlabel,\n\t\theading,\n\t\tnavLabel = 'Jump to card',\n\t\tref = $bindable(null),\n\t\tclass: className,\n\t\t...restProps\n\t}: Props = $props();\n\n\t// Layout is fixed in pixels so every scroll position can be computed rather\n\t// than measured: sticky elements report their stuck position, not their\n\t// natural one, so measuring them mid-scroll would be wrong anyway.\n\tconst VIEWPORT = 480;\n\tconst HEADER = 112;\n\tconst CARD = 280;\n\t/** Scroll distance between one card settling and the next one arriving. */\n\tconst GAP = 80;\n\tconst FIRST_TOP = 20;\n\t/** Each stuck card sits this much lower, leaving a strip of every card beneath it. */\n\tconst STEP = 14;\n\t/** Per card resting on top. Four deep reaches 0.84, still a stack rather than a fan. */\n\tconst SCALE_PER_CARD = 0.04;\n\tconst DIM_PER_CARD = 0.12;\n\tconst MAX_DIM = 0.4;\n\n\tlet scroller = $state<HTMLDivElement | null>(null);\n\tlet front = $state(0);\n\n\tconst header = $derived(heading ? HEADER : FIRST_TOP);\n\tconst last = $derived(items.length - 1);\n\tconst top = (i: number) => FIRST_TOP + i * STEP;\n\tconst natural = (i: number) => header + i * (CARD + GAP);\n\t// Just enough room below the last card for it to reach its stuck spot, so\n\t// the scroll ends exactly as the stack completes.\n\tconst bottomPad = $derived(Math.max(0, VIEWPORT - CARD - top(last)));\n\n\t$effect(() => {\n\t\tconst el = scroller;\n\t\tconst count = items.length;\n\t\t// Read so the effect reruns when the heading comes or goes.\n\t\tvoid header;\n\t\tif (!el || count === 0) return;\n\t\tconst reduce = prefersReducedMotion();\n\t\tconst cards = Array.from(el.querySelectorAll<HTMLElement>('[data-sticky-stack-card]'));\n\t\tconst shades = Array.from(el.querySelectorAll<HTMLElement>('[data-sticky-stack-shade]'));\n\t\tconst fills = Array.from(ref?.querySelectorAll<HTMLElement>('[data-sticky-stack-fill]') ?? []);\n\t\tlet frame = 0;\n\n\t\t// One read (scrollTop) and a batch of scale and opacity writes per frame,\n\t\t// nothing that triggers layout.\n\t\tconst update = () => {\n\t\t\tframe = 0;\n\t\t\tconst s = el.scrollTop;\n\t\t\t// How far card i + 1 has slid over card i, 0 to 1: from its top edge\n\t\t\t// meeting card i's bottom edge until it sticks.\n\t\t\tconst covered = Array.from({ length: count }, (_, i) => {\n\t\t\t\tif (i === count - 1) return 0;\n\t\t\t\tconst start = natural(i + 1) - top(i) - CARD;\n\t\t\t\tconst end = natural(i + 1) - top(i + 1);\n\t\t\t\treturn Math.min(Math.max((s - start) / (end - start), 0), 1);\n\t\t\t});\n\n\t\t\tlet depth = 0;\n\t\t\tfor (let i = count - 1; i >= 0; i--) {\n\t\t\t\tdepth += covered[i];\n\t\t\t\tif (cards[i]) cards[i].style.scale = reduce ? '' : String(1 - depth * SCALE_PER_CARD);\n\t\t\t\tif (shades[i]) {\n\t\t\t\t\tshades[i].style.opacity = reduce ? '0' : String(Math.min(depth * DIM_PER_CARD, MAX_DIM));\n\t\t\t\t}\n\t\t\t\tif (fills[i]) fills[i].style.scale = `1 ${i === 0 ? 1 : covered[i - 1]}`;\n\t\t\t}\n\t\t\tfront = covered.filter((c) => c >= 0.5).length;\n\t\t};\n\n\t\tconst onscroll = () => {\n\t\t\tframe ||= requestAnimationFrame(update);\n\t\t};\n\n\t\tupdate();\n\t\tel.addEventListener('scroll', onscroll, { passive: true });\n\t\treturn () => {\n\t\t\tel.removeEventListener('scroll', onscroll);\n\t\t\tcancelAnimationFrame(frame);\n\t\t};\n\t});\n\n\tfunction goTo(i: number) {\n\t\tscroller?.scrollTo({\n\t\t\ttop: i === 0 ? 0 : natural(i) - top(i),\n\t\t\tbehavior: prefersReducedMotion() ? 'auto' : 'smooth'\n\t\t});\n\t}\n</script>\n\n<div {...restProps} bind:this={ref} class={cn('flex w-[min(480px,100%)] gap-2', className)}>\n\t<!-- A focusable region so keyboard readers can scroll it with the arrow keys. -->\n\t<!-- svelte-ignore a11y_no_noninteractive_tabindex -->\n\t<div\n\t\tbind:this={scroller}\n\t\trole=\"region\"\n\t\taria-label={label}\n\t\ttabindex=\"0\"\n\t\tclass=\"bg-secondary dark:bg-card focus-visible:ring-ring focus-visible:ring-offset-background min-w-0 flex-1 [scrollbar-width:none] overflow-y-auto overscroll-contain rounded-3xl px-4 outline-none focus-visible:ring-2 focus-visible:ring-offset-2 [&::-webkit-scrollbar]:hidden\"\n\t\tstyle:height=\"{VIEWPORT}px\"\n\t>\n\t\t<div style:padding-bottom=\"{bottomPad}px\">\n\t\t\t<div class=\"flex flex-col justify-center gap-1 px-2\" style:height=\"{header}px\">\n\t\t\t\t{@render heading?.()}\n\t\t\t</div>\n\t\t\t{#each items as item, i (i)}\n\t\t\t\t<article\n\t\t\t\t\tdata-sticky-stack-card\n\t\t\t\t\tclass=\"bg-card dark:bg-secondary sticky flex origin-top flex-col justify-between rounded-2xl p-6 shadow-sm will-change-transform\"\n\t\t\t\t\tstyle:top=\"{top(i)}px\"\n\t\t\t\t\tstyle:height=\"{CARD}px\"\n\t\t\t\t\tstyle:margin-top={i === 0 ? '0px' : `${GAP}px`}\n\t\t\t\t>\n\t\t\t\t\t<span class=\"text-muted-foreground font-mono text-sm tabular-nums\" aria-hidden=\"true\">\n\t\t\t\t\t\t{String(i + 1).padStart(2, '0')}\n\t\t\t\t\t</span>\n\t\t\t\t\t<div class=\"flex flex-col gap-2\">\n\t\t\t\t\t\t<h3 class=\"text-xl font-semibold tracking-tight text-balance sm:text-2xl\">\n\t\t\t\t\t\t\t{item.title}\n\t\t\t\t\t\t</h3>\n\t\t\t\t\t\t<p class=\"text-muted-foreground text-sm leading-relaxed text-pretty sm:text-[15px]\">\n\t\t\t\t\t\t\t{item.description}\n\t\t\t\t\t\t</p>\n\t\t\t\t\t</div>\n\t\t\t\t\t<!-- Buried cards sink into the surface they sit on. -->\n\t\t\t\t\t<div\n\t\t\t\t\t\tdata-sticky-stack-shade\n\t\t\t\t\t\taria-hidden=\"true\"\n\t\t\t\t\t\tclass=\"bg-secondary dark:bg-card pointer-events-none absolute inset-0 rounded-[inherit] opacity-0\"\n\t\t\t\t\t></div>\n\t\t\t\t</article>\n\t\t\t{/each}\n\t\t</div>\n\t</div>\n\t<nav aria-label={navLabel} class=\"flex flex-col justify-center\">\n\t\t{#each items as item, i (i)}\n\t\t\t<button\n\t\t\t\ttype=\"button\"\n\t\t\t\taria-label=\"{i + 1}. {item.title}\"\n\t\t\t\taria-current={front === i ? 'step' : undefined}\n\t\t\t\tonclick={() => goTo(i)}\n\t\t\t\tclass=\"group focus-visible:ring-ring flex h-10 w-6 touch-manipulation items-center justify-center rounded-full transition-[scale] duration-(--duration-fast) ease-out outline-none focus-visible:ring-2 active:scale-[0.96] motion-reduce:transition-none\"\n\t\t\t>\n\t\t\t\t<span\n\t\t\t\t\tclass=\"bg-control h-7 w-[3px] overflow-hidden rounded-full transition-[scale] duration-(--duration-fast) ease-out group-hover:scale-x-150 motion-reduce:transition-none\"\n\t\t\t\t>\n\t\t\t\t\t<!-- Fills as the card arrives. Matches scroll position 0 before the effect runs. -->\n\t\t\t\t\t<span\n\t\t\t\t\t\tdata-sticky-stack-fill\n\t\t\t\t\t\tclass=\"bg-primary block size-full origin-top\"\n\t\t\t\t\t\tstyle:scale=\"1 {i === 0 ? 1 : 0}\"\n\t\t\t\t\t></span>\n\t\t\t\t</span>\n\t\t\t</button>\n\t\t{/each}\n\t</nav>\n</div>\n"
    }
  ]
}
