{
  "$schema": "https://shadcn-svelte.com/schema/registry-item.json",
  "name": "wave-text",
  "type": "registry:ui",
  "title": "Wave Text",
  "description": "Letters rise in a wave that follows your cursor.",
  "dependencies": [],
  "registryDependencies": [
    "https://mizu-ui.com/r/motion.json",
    "https://mizu-ui.com/r/utils.json"
  ],
  "files": [
    {
      "type": "registry:file",
      "target": "wave-text/index.ts",
      "content": "export { default as WaveText } from './wave-text.svelte';\n"
    },
    {
      "type": "registry:file",
      "target": "wave-text/wave-text.svelte",
      "content": "<script lang=\"ts\">\n\timport type { Attachment } from 'svelte/attachments';\n\timport type { HTMLAttributes } from 'svelte/elements';\n\timport {\n\t\tduration,\n\t\teaseOut,\n\t\tprefersReducedMotion,\n\t\tSpringValue,\n\t\tspringPresets\n\t} from '$lib/components/ui/motion';\n\timport { cn } from '$lib/utils.js';\n\n\ttype Props = Omit<HTMLAttributes<HTMLElement>, 'children'> & {\n\t\t/** The text. Assistive technology reads it once, as plain text. */\n\t\ttext: string;\n\t\t/** The element to render. */\n\t\tas?: 'span' | 'p' | 'h1' | 'h2' | 'h3';\n\t\t/** The root element. */\n\t\tref?: HTMLElement | null;\n\t\t/** Classes for the root. */\n\t\tclass?: string;\n\t};\n\n\tlet {\n\t\ttext,\n\t\tas = 'span',\n\t\tref = $bindable(null),\n\t\tclass: className,\n\t\t...restProps\n\t}: Props = $props();\n\n\tconst words = $derived(text.split(' ').map((word) => Array.from(word)));\n\n\t/** How high the crest lifts a letter, in em, so it scales with the type. */\n\tconst LIFT = 0.18;\n\t/** How much the crest grows a letter. */\n\tconst GROW = 0.08;\n\t/** How far the wave reaches either side of the pointer, in em: about two letters. */\n\tconst SPREAD = 1;\n\t/** How far letters away from the pointer fade toward muted for reduced motion, in percent. */\n\tconst DIM = 45;\n\t/** A tap ripple has to cross the whole line, so it runs longer than UI motion. */\n\tconst RIPPLE = duration.slow + duration.deliberate;\n\n\tconst bell = (distance: number) => Math.exp(-(distance * distance));\n\n\t// Everything runs outside Svelte's state: springs and the ripple write\n\t// straight to each letter's style, once per frame, and sleep at rest.\n\tconst wave: Attachment<HTMLElement> = (root) => {\n\t\tvoid words;\n\t\tconst letters = Array.from(root.querySelectorAll<HTMLElement>('[data-letter]'));\n\t\tconst reduce = prefersReducedMotion();\n\t\tconst centers: { x: number; y: number; h: number }[] = [];\n\t\tlet em = 16;\n\t\tlet frame = 0;\n\t\tlet rippleFrame = 0;\n\t\tlet ripple = 1;\n\t\tlet rippleFrom = 0;\n\t\tlet rippleWidth = 1;\n\n\t\t// Measured on mount and resize, never per frame. Offsets ignore\n\t\t// transforms, so a lifted letter still reports where it rests.\n\t\tconst measure = () => {\n\t\t\tem = parseFloat(getComputedStyle(root).fontSize) || 16;\n\t\t\tletters.forEach((letter, i) => {\n\t\t\t\tcenters[i] = {\n\t\t\t\t\tx: letter.offsetLeft + letter.offsetWidth / 2,\n\t\t\t\t\ty: letter.offsetTop + letter.offsetHeight / 2,\n\t\t\t\t\th: letter.offsetHeight || em\n\t\t\t\t};\n\t\t\t});\n\t\t};\n\n\t\tconst paint = () => {\n\t\t\tframe = 0;\n\t\t\tconst px = pointerX.current;\n\t\t\tconst py = pointerY.current;\n\t\t\tconst h = hover.current;\n\t\t\tletters.forEach((letter, i) => {\n\t\t\t\tconst c = centers[i];\n\t\t\t\tif (!c) return;\n\t\t\t\t// The crest follows the pointer along the line it is on.\n\t\t\t\tconst near = bell((px - c.x) / (SPREAD * em)) * bell((py - c.y) / c.h) * h;\n\t\t\t\tlet strength = near;\n\t\t\t\tif (ripple < 1) {\n\t\t\t\t\t// The ring's radius grows with progress while its height fades out.\n\t\t\t\t\tconst ring = Math.abs(c.x - rippleFrom) - ripple * rippleWidth;\n\t\t\t\t\tstrength = Math.max(near, bell(ring / (SPREAD * em)) * (1 - ripple));\n\t\t\t\t}\n\t\t\t\tif (reduce) {\n\t\t\t\t\tconst dim = Math.round(DIM * Math.max(0, h - strength));\n\t\t\t\t\tletter.style.color = dim\n\t\t\t\t\t\t? `color-mix(in oklab, currentColor, var(--muted-foreground) ${dim}%)`\n\t\t\t\t\t\t: '';\n\t\t\t\t} else if (strength < 0.001) {\n\t\t\t\t\tletter.style.removeProperty('translate');\n\t\t\t\t\tletter.style.removeProperty('scale');\n\t\t\t\t} else {\n\t\t\t\t\tletter.style.translate = `0 ${(-LIFT * strength).toFixed(4)}em`;\n\t\t\t\t\tletter.style.scale = `${(1 + GROW * strength).toFixed(4)}`;\n\t\t\t\t}\n\t\t\t});\n\t\t};\n\t\tconst schedule = () => {\n\t\t\tframe ||= requestAnimationFrame(paint);\n\t\t};\n\n\t\t// Soft enough that the crest trails the pointer a little, with no\n\t\t// overshoot, so letters never dip below the baseline.\n\t\tconst pointerX = new SpringValue(0, { preset: springPresets.smooth, onUpdate: schedule });\n\t\tconst pointerY = new SpringValue(0, { preset: springPresets.smooth, onUpdate: schedule });\n\t\tconst hover = new SpringValue(0, { preset: springPresets.smooth, onUpdate: schedule });\n\n\t\tconst local = (event: PointerEvent) => {\n\t\t\tconst box = root.getBoundingClientRect();\n\t\t\t// Rects are after transforms; a scaled ancestor would double the offset.\n\t\t\tconst scale = box.width / root.offsetWidth || 1;\n\t\t\treturn { x: (event.clientX - box.left) / scale, y: (event.clientY - box.top) / scale };\n\t\t};\n\n\t\tconst enter = (event: PointerEvent) => {\n\t\t\tif (event.pointerType === 'touch') return;\n\t\t\t// Fresh positions for this visit, in case the line reflowed.\n\t\t\tmeasure();\n\t\t\t// Start the crest under the pointer instead of sweeping in from the edge.\n\t\t\tconst { x, y } = local(event);\n\t\t\tpointerX.jump(x);\n\t\t\tpointerY.jump(y);\n\t\t};\n\t\tconst move = (event: PointerEvent) => {\n\t\t\tif (event.pointerType === 'touch') return;\n\t\t\tconst { x, y } = local(event);\n\t\t\tpointerX.set(x);\n\t\t\tpointerY.set(y);\n\t\t\thover.set(1);\n\t\t};\n\t\tconst leave = () => hover.set(0);\n\t\tconst down = (event: PointerEvent) => {\n\t\t\tif (event.pointerType !== 'touch' || reduce) return;\n\t\t\trippleFrom = local(event).x;\n\t\t\trippleWidth = root.offsetWidth || 1;\n\t\t\tcancelAnimationFrame(rippleFrame);\n\t\t\tlet start: number | undefined;\n\t\t\tconst step = (now: number) => {\n\t\t\t\tstart ??= now;\n\t\t\t\tconst t = Math.min(1, (now - start) / RIPPLE);\n\t\t\t\tripple = easeOut(t);\n\t\t\t\tpaint();\n\t\t\t\trippleFrame = t < 1 ? requestAnimationFrame(step) : 0;\n\t\t\t};\n\t\t\trippleFrame = requestAnimationFrame(step);\n\t\t};\n\n\t\tmeasure();\n\t\tconst observer = typeof ResizeObserver === 'undefined' ? null : new ResizeObserver(measure);\n\t\tobserver?.observe(root);\n\t\troot.addEventListener('pointerenter', enter);\n\t\troot.addEventListener('pointermove', move);\n\t\troot.addEventListener('pointerleave', leave);\n\t\troot.addEventListener('pointerdown', down);\n\t\treturn () => {\n\t\t\tobserver?.disconnect();\n\t\t\tcancelAnimationFrame(frame);\n\t\t\tcancelAnimationFrame(rippleFrame);\n\t\t\tfor (const spring of [pointerX, pointerY, hover]) spring.stop();\n\t\t\troot.removeEventListener('pointerenter', enter);\n\t\t\troot.removeEventListener('pointermove', move);\n\t\t\troot.removeEventListener('pointerleave', leave);\n\t\t\troot.removeEventListener('pointerdown', down);\n\t\t\tfor (const letter of letters) {\n\t\t\t\tletter.style.removeProperty('translate');\n\t\t\t\tletter.style.removeProperty('scale');\n\t\t\t\tletter.style.removeProperty('color');\n\t\t\t}\n\t\t};\n\t};\n</script>\n\n<svelte:element\n\tthis={as}\n\t{...restProps}\n\tbind:this={ref}\n\t{@attach wave}\n\tclass={cn('relative cursor-default select-none', className)}\n>\n\t<span class=\"sr-only\">{text}</span>\n\t<span aria-hidden=\"true\"\n\t\t>{#each words as word, w (w)}{w > 0 ? ' ' : ''}<span class=\"inline-block whitespace-nowrap\"\n\t\t\t\t>{#each word as char, c (c)}<span data-letter class=\"inline-block origin-bottom\"\n\t\t\t\t\t\t>{char}</span\n\t\t\t\t\t>{/each}</span\n\t\t\t>{/each}</span\n\t>\n</svelte:element>\n"
    }
  ]
}
